{
  "$schema": "https://json-schema.org/draft/2020-12/schema",
  "title": "Private instance denylist",
  "type": "object",
  "additionalProperties": false,
  "required": ["hosts", "domains", "ips", "sites", "secretNames"],
  "properties": {
    "hosts": {
      "type": "array",
      "minItems": 1,
      "uniqueItems": true,
      "items": {
        "type": "string",
        "minLength": 1
      }
    },
    "domains": {
      "type": "array",
      "minItems": 1,
      "uniqueItems": true,
      "items": {
        "type": "string",
        "minLength": 1
      }
    },
    "ips": {
      "type": "array",
      "minItems": 1,
      "uniqueItems": true,
      "items": {
        "type": "string",
        "minLength": 1
      }
    },
    "sites": {
      "type": "array",
      "minItems": 1,
      "uniqueItems": true,
      "items": {
        "type": "string",
        "minLength": 1
      }
    },
    "secretNames": {
      "type": "array",
      "minItems": 1,
      "uniqueItems": true,
      "items": {
        "type": "string",
        "minLength": 1
      }
    },
    "nodes": {
      "type": "object",
      "propertyNames": {
        "minLength": 1
      },
      "additionalProperties": {
        "type": "object",
        "additionalProperties": false,
        "required": ["ssh", "tailnetIPv4", "home", "dataRoot"],
        "properties": {
          "celldMemoryMax": {
            "type": "string",
            "pattern": "^[1-9][0-9]*(?:\\.[0-9]+)?[KMGT]?$"
          },
          "privateCgroupView": { "type": "boolean" },
          "ssh": {
            "type": "string",
            "pattern": "^(?!-)[A-Za-z0-9_.@:-]+$"
          },
          "tailnetIPv4": {
            "type": "string",
            "format": "ipv4",
            "pattern": "^(?:\\d{1,3}\\.){3}\\d{1,3}$"
          },
          "home": {
            "type": "string",
            "pattern": "^/(?!$)(?!\\.{1,2}(?:/|$))(?!.*/\\.{1,2}(?:/|$))(?!.*//)[^\\r\\n\\0]*[^/\\r\\n\\0]$"
          },
          "dataRoot": {
            "type": "string",
            "pattern": "^/(?!$)(?!\\.{1,2}(?:/|$))(?!.*/\\.{1,2}(?:/|$))(?!.*//)[^\\r\\n\\0]*[^/\\r\\n\\0]$"
          }
        }
      }
    }
  }
}
